{
 "niveau": 7,
 "nom": "E7 — L’ABYSSE DU MIROIR",
 "style": "scifi",
 "sky": true,
 "angle": 0,
 "rows": [
  "#################################",
  "#P......#.....g.......H...#..E###",
  "#....A..#..............m.....!53#",
  "#.......Q#........O...C......####",
  "#.V..S.....Q........O###...######",
  "#.........%..........#.3.#.######",
  "#.######%%%.k.......#....########",
  "%.........%....O....#.1.#########",
  "%.........%.........#....########",
  "%........#.%.......#.5.#.########",
  "%........#=%.O..O..###...########",
  "#........#...........%.3.#.######",
  "########%%.....O...%.4..#.1..####",
  "%..........L.....%Q...O.#.H.##%##",
  "%......k....A............#.....##",
  "%...O......O...O.........#2..m###",
  "%.5.......#...............#....##",
  "#.........%...5.Q.....O...#....##",
  "#.######%%.............%.#.....##",
  "%.........%..........1.%#......##",
  "%.........%.........#...#.3.##%##",
  "%........#.%......O#...#.m..#####",
  "%........#=%.......#...#....#####",
  "#........#...Q..O....%.5.#.....##",
  "########%%.........%....#.g..####",
  "%..........L.....%......#.H.###%#",
  "#################################"
 ]
}
