{
 "niveau": 36,
 "nom": "E36 — CATHÉDRALE FONDUE",
 "rows": [
  "########################################",
  "#P...#......#...............#........###",
  "#....#...4..#..5.#.@.......#.2.&.....###",
  "#...........#.........H.....#...~....###",
  "#.A.#....5..#...............#...k....###",
  "#.##%########............###K..m....####",
  "#........#................#..........###",
  "#.4..............o........#.3........E##",
  "#.........H.................~........###",
  "#.@....A.#..@...............3........###",
  "#........#................#..........###",
  "###$####%######...........##.........###",
  "#...M...#..............#......1.2....###",
  "#.......#..H.........m.#............####",
  "#.......#...............#HA.....k....###",
  "########@############!####...........E##",
  "########3############@####.#############",
  "########!############5####.............#",
  "##..........V........#................##",
  "##...1......o.3......#..x.........5...##",
  "##............H......#.A.....m.......k##",
  "###%###############...########.........#",
  "#............................#........E#",
  "#.@..............&...........#........##",
  "#..........~.................#........##",
  "#.2..3.........4...5.........#........##",
  "##########################.............#",
  "########################################"
 ],
 "zones": {
  "vestibule": [
   1,
   1,
   6,
   5
  ],
  "nef_ouest": [
   7,
   1,
   9,
   5
  ],
  "crypte": [
   17,
   1,
   8,
   5
  ],
  "planque_vitre": [
   26,
   1,
   4,
   3
  ],
  "chapelles": [
   1,
   6,
   10,
   5
  ],
  "nef_est": [
   12,
   6,
   9,
   5
  ],
  "sanctuaire": [
   22,
   1,
   8,
   7
  ],
  "sortie": [
   34,
   1,
   5,
   7
  ]
 },
 "style": "scifi"
}
