{
 "niveau": 45,
 "nom": "E45 — FOND DE PUIT",
 "rows": [
  "%%%%%%%%%%%%%%%%%%%%%%%%%%%%%%%%%%%%%%%##",
  "%......#.............................%###",
  "%.P....=..1..........A.........H...k.%###",
  "%......%.......................2.....%###",
  "%..H...%................................#",
  "%......%...........5...............2..%##",
  "%%%....%%%.%%%%K%%%%%%%%%%%#%%%%%%%%%%%%%",
  "%...........................V...........#",
  "%....1..........m.........1............A#",
  "%.......................w...............#",
  "%.H.....................................#",
  "%......6.............s...............2..%",
  "%%%%%%%%%%%%!%%%%%%%%%%%%%%%%%!%%%%%%%%E#",
  "############1#################2##########",
  "############2#################5##########",
  "#########################################",
  "#########################################",
  "#########################################",
  "#########################################",
  "#########################################",
  "#########################################",
  "#########################################",
  "#########################################",
  "#########################################",
  "#########################################",
  "#########################################",
  "#########################################",
  "#########################################",
  "#########################################"
 ],
 "zones": {
  "vestiaire": [
   0,
   0,
   8,
   5
  ],
  "galerie": [
   7,
   1,
   34,
   6
  ],
  "cuves": [
   1,
   7,
   29,
   5
  ],
  "poussiere": [
   28,
   7,
   3,
   1
  ],
  "reacteur": [
   1,
   12,
   39,
   1
  ]
 },
 "style": "scifi"
}
