{
 "niveau": 24,
 "nom": "E24 — FORGE DES CENDRES",
 "rows": [
  "#########################################",
  "#...P...#%...1......m.......~........A.##",
  "#.H......%%%............%%%%%%~~~~~~~~~%#",
  "#.......#%%%%%%%%%%%%%%%~...............#",
  "#.........5..........k.........~........%",
  "#......#%%%%%%%%%%%%%%%%~~~%%%%.~~~~%%%##",
  "###4....####################%....g.....%#",
  "#.A....#%.............2...&............%#",
  "#.......%%%%%%%%%%~~~~~~~~~~~~~%%%H..V.%#",
  "#......#%.5...........k...............%##",
  "#......#%%%%%%%%%%%%%%%%%%%%~~~%%%%E%%%##",
  "###.....####################%.....6...K%#",
  "#.r....#%...................&..........%#",
  "#.......%%%%%%%%%%~~~~~~~~~~~~%%%1..2.%##",
  "#......#%.4.......A.............k......%#",
  "#......#%%%%%%%%%%%%%%%%%%%%~~~%%%%%%%E%#",
  "###.....####################%.....H....%#",
  "#.m....#%...................&..........%#",
  "#.......%%%%%%%%%%~~~~~~~~~~~~%%%2..s.%##",
  "#......#%.5.......k.............A......%#",
  "#......#%%%%%%%%%%%%%%%%%%%%~~~%%%%%%%E%#",
  "###.....####################%.....H....%#",
  "#.m....#%...................&..........%#",
  "#.......%%%%%%%%%%~~~~~~~~~~~~%%%2..1.%##",
  "#......#%.x.......A.............k......%#",
  "#......#%%%%%%%%%%%%%%%%%%%%~~~%%%%%%%E%#",
  "###.....####################%.....H....%#",
  "#.m....#%...................&..........%#",
  "########%%%%%%%%%%############%%%#####%##"
 ],
 "zones": {
  "vestibule": [
   0,
   0,
   8,
   5
  ],
  "couloir_nord": [
   9,
   0,
   30,
   4
  ],
  "salle_fusion": [
   9,
   6,
   12,
   6
  ],
  "galerie_lave": [
   9,
   12,
   30,
   5
  ],
  "chambre_cles": [
   0,
   6,
   8,
   6
  ],
  "arriere_fournaise": [
   9,
   17,
   30,
   4
  ],
  "arene_magma": [
   9,
   21,
   30,
   5
  ],
  "sortie_crateresque": [
   39,
   18,
   1,
   6
  ]
 },
 "style": "scifi"
}
