{
 "niveau": 52,
 "nom": "E52 — L'ABATTOIR VERT",
 "style": "scifi",
 "sky": false,
 "rows": [
  "########%%%%%%%%%%####################",
  "#H.....#%A.4....m%####################",
  "#......#%......@.%####################",
  "#...P...=..%..%..%####################",
  "#......#%........%####################",
  "########%...@....#####################",
  "########%.......4.................####",
  "########%@........####################",
  "########%%%%%%%%..#A........3.A##%%%%%",
  "########%H.....@..#3...........##%...%",
  "########%5........#..#..#..#...##%...%",
  "########%.........=.....&......##%...%",
  "########%........##............##%...%",
  "########%......5.##..#..#..#.........E",
  "########%%%%!%%%.##............##%%%%%",
  "############3###.##............#######",
  "############@###.##............#######",
  "################.##H..3.......3#######",
  "################.####!################",
  "################.####@################",
  "################.####5################",
  "##########V..H##.#####################",
  "##########....$..#####################",
  "##########....########################",
  "######################################",
  "######################################"
 ],
 "zones": {
  "vestibule": [
   1,
   1,
   6,
   4
  ],
  "serre": [
   9,
   1,
   8,
   7
  ],
  "conduit": [
   18,
   6,
   16,
   1
  ],
  "bassin": [
   9,
   9,
   7,
   5
  ],
  "distillation": [
   19,
   8,
   12,
   10
  ],
  "sortie": [
   34,
   9,
   3,
   5
  ],
  "cache": [
   10,
   21,
   4,
   3
  ]
 }
}
