{
 "niveau": 65,
 "nom": "E65 — L'ANTRE DE BRUME",
 "style": "scifi",
 "sky": false,
 "rows": [
  "#########################################",
  "#########################A1....5#%%%%%%##",
  "#H......%%%%%%%%%%%%%%###.......#%....%##",
  "#...........q.......4...........#%....%##",
  "#...P...%%%%%%%%%%..............r$H...%##",
  "#.......##########.######.......#%%%%%%##",
  "#.......##########.######1..5..q#########",
  "##################R############E#########",
  "##########A......2.######################",
  "##########.x.......####%%%%%%%%%%%%%%%###",
  "##########..#..#...####%H4.......q..H%###",
  "##########....5........=.............%###",
  "##########.........####%..%..%..%....%###",
  "##########.........####%.............%###",
  "##########m5......2####%.............%###",
  "##############!########%..%..%..%....%###",
  "##############4########%.............%###",
  "##############5########%.............%###",
  "#######################%k.4.........6...#",
  "#######################%%%%%!%%%%%%%%%#.#",
  "############################5##########.#",
  "############################q##########I#",
  "%%%%%%#################################.#",
  "%V...%#################################=#",
  "%....$................................44#",
  "%....%################################..#",
  "%%%%%%################################.4#",
  "######################################AH#",
  "#########################################"
 ],
 "zones": {
  "vestiaire": [
   1,
   2,
   7,
   5
  ],
  "corridor_nord": [
   9,
   3,
   12,
   1
  ],
  "laboratoire": [
   25,
   1,
   7,
   6
  ],
  "claire_murante": [
   34,
   2,
   4,
   3
  ],
  "galerie_lave": [
   10,
   8,
   9,
   7
  ],
  "chambre_baron": [
   24,
   10,
   13,
   9
  ],
  "vestibule_sortie": [
   38,
   24,
   2,
   4
  ],
  "cache_bris": [
   1,
   23,
   4,
   3
  ]
 }
}
