{
 "niveau": 57,
 "nom": "E57 — CRYPTES DE SEL",
 "style": "scifi",
 "sky": false,
 "rows": [
  "######################################",
  "######################################",
  "#H.....###################r....dA#####",
  "#......%%%%%##############d......!d5##",
  "#...P....4d.........K..I.=.......#####",
  "#......%%%%%##############.......#####",
  "#......###################A.5...x#####",
  "####.##########################$######",
  "####.########%%%%%%%%%%#######VH######",
  "####.########%A2.....H%###############",
  "####.########%......4.%##k.........H##",
  "####.########%..%..%..%##3..........##",
  "####.............z......R...........##",
  "#############%........%##...........##",
  "#############%........%##...........##",
  "#############%2......2%##...........##",
  "#############%%%%%%%%%%##..........6##",
  "#########################...3.......##",
  "##############################!##.####",
  "##############################5##.####",
  "##############################2%%=%%%#",
  "##############################%A....%#",
  "##############################%5....%#",
  "##############################%.....%#",
  "##############################%....5E#",
  "##############################%%%%%%%#"
 ],
 "zones": {
  "vestiaire": [
   1,
   2,
   6,
   5
  ],
  "galerie_nord": [
   8,
   4,
   3,
   1
  ],
  "magasin": [
   26,
   2,
   7,
   5
  ],
  "chambre_cendres": [
   14,
   9,
   8,
   7
  ],
  "arene_sel": [
   25,
   10,
   11,
   8
  ],
  "extraction": [
   31,
   21,
   5,
   4
  ],
  "puit_sel": [
   30,
   8,
   2,
   1
  ]
 }
}
