{
 "niveau": 71,
 "nom": "E71 — LE VENTRE DU RIFLEUR",
 "style": "scifi",
 "sky": false,
 "rows": [
  "########################################",
  "########################################",
  "##H.....######################A.....4###",
  "##......#%%%%%%%%%%%%%%%%%%%%#.......###",
  "##...P.......................B.......###",
  "##.......%%%%%%%%%%%%%%%%%%%%#.......###",
  "##.......#############........4....@.###",
  "#####.##.#############.#################",
  "%%%%%=%%.##########4##.#################",
  "%b...@...##########@##.#######H&....A###",
  "%4......%##########!##.#V.H###.......###",
  "%..%...................$...###.......###",
  "%......4%A.@....&......%...###.......###",
  "%.......%.............&%######.......###",
  "%..%....%..%..%..%..%..%######.......###",
  "%.......%..............%######.......###",
  "%Az...@H%3...................R&......###",
  "%%%%%%%%%..%..%..%..%..%######.......###",
  "######&4!..............%######.......###",
  "########%r.....@.....3H%######.......###",
  "########%%%%%%%%%%%%%%%%######......6###",
  "#################################.######",
  "###########################%%%%%%.%#####",
  "###########################%......%#####",
  "###########################%......%#####",
  "###########################%......%#####",
  "###########################%......E#####",
  "###########################%%%%%%%%#####"
 ],
 "zones": {
  "vestibule": [
   2,
   2,
   6,
   5
  ],
  "galerie_nord": [
   10,
   4,
   19,
   1
  ],
  "chambre_oeufs": [
   30,
   2,
   7,
   5
  ],
  "incubation": [
   1,
   9,
   7,
   8
  ],
  "secret_glande": [
   24,
   10,
   3,
   3
  ],
  "arene_couronne": [
   9,
   12,
   14,
   8
  ],
  "chambre_coeur": [
   30,
   9,
   7,
   12
  ],
  "sortie_vaisseau": [
   28,
   23,
   6,
   4
  ]
 }
}
