{
 "niveau": 47,
 "nom": "E47 — SILLONS DE FER",
 "rows": [
  "########################################",
  "#....#..............%..................#",
  "#P...=......r.......%.....@..........&.#",
  "#H...#..............R..................#",
  "#....##%%%%%%#####%%%...........k......#",
  "#....#4.........A.@.............m......#",
  "###$###%%%%%%%%%%%%%%..~~~..@@..m......#",
  "#.V.H.%.....H.....H......~~~~.....&....#",
  "##########%%%%%%%%%%%%%%%%%.~~~~~~~~...#",
  "%........@...2..............~~~~~~~~.5.#",
  "%.................................5....#",
  "###..........................####%%%%%%#",
  "%.~....................................#",
  "#.~~~......k..................5........#",
  "%.~~~~~....&.......@@..................#",
  "%.~~~~~~~~............%..............@H#",
  "%.................................s...%#",
  "###..........................####%%%%%%#",
  "%......................................#",
  "%.~~~......k..................5........#",
  "%.~~~~~....&.......@@..................#",
  "%.~~~~~~~~............%..............@.#",
  "%.................................2...%#",
  "#E#..........................####%%%%%%#",
  "%......................................#",
  "%.~~~......k..................5........#",
  "%.~~~~~....&.......@@..................#",
  "%#####################%#################"
 ],
 "zones": {
  "vestiaire": [
   1,
   2,
   4,
   3
  ],
  "galeries": [
   6,
   2,
   9,
   3
  ],
  "pompage": [
   17,
   2,
   20,
   8
  ],
  "clairet": [
   5,
   11,
   22,
   8
  ],
  "bassin": [
   29,
   11,
   6,
   8
  ],
  "puit": [
   3,
   20,
   7,
   4
  ]
 },
 "style": "scifi"
}
