{
 "niveau": 59,
 "nom": "E59 — CULTE DU VIDE",
 "style": "scifi",
 "sky": false,
 "rows": [
  "#############################%%%%%%%%%%%#",
  "#############################%A.......1%#",
  "#H.....#########A......5H####%.........%#",
  "#......#%%%%%%%#w........####%.........%#",
  "#......#%.....%#..#..#...####%.........%#",
  "#...P.........%#.........####%.........%#",
  "#......#%.....%#.............=.........%#",
  "#..............=..#..#...####%1.......5%#",
  "#......####.####.........####%%%%%%%%%.%#",
  "###########.####........4#############.##",
  "###########................=4.......A#.##",
  "############################.........#.##",
  "############################..#..#...#.##",
  "############################.........#.##",
  "##########################...........#.##",
  "##########################.#..#..#...#.##",
  "##########################.#.........#.##",
  "################4#########.#H5......q#.##",
  "################3#########.###########.##",
  "#############%%%!%%%%%%%%%=%##########=##",
  "#############%A......&.....%########A..H#",
  "#############%3............%########....#",
  "#############%..%..%..%....%########....#",
  "#############%.............%########...6#",
  "#############%.............!53######....E",
  "#############%.............%#############",
  "#############%H...........3%#############",
  "#############%%%%%%%%%%%%%%%#############",
  "#########################################"
 ],
 "zones": {
  "vestibule": [
   1,
   2,
   6,
   7
  ],
  "narthex": [
   9,
   4,
   5,
   3
  ],
  "nef_ouest": [
   16,
   2,
   9,
   8
  ],
  "chapelle": [
   30,
   1,
   9,
   7
  ],
  "nef_est": [
   28,
   10,
   9,
   8
  ],
  "sanctuaire": [
   14,
   20,
   13,
   7
  ],
  "intronisation": [
   36,
   20,
   4,
   5
  ]
 }
}
