{
 "niveau": 48,
 "nom": "E48 — CATHÉDRALE DE GLACE",
 "rows": [
  "########################################",
  "#....#..%...................%.........##",
  "#....#..%......1.....@......%.&.......##",
  "#.......%..A........z........%.........#",
  "#r.b.j................m..........H....##",
  "#..P....%.............1...........E...##",
  "####.#..###############%%###############",
  "#....#.....................#...........#",
  "#..........................V.H.........#",
  "#.................4.......&............#",
  "#.4.@.............................H....#",
  "#########=#####################J########",
  "#......................................#",
  "#..q..@.............q...........A....#.#",
  "#............m..............&.....E....#",
  "#......................6.&............##",
  "#######!#.###########################!##",
  "#######q#.###########################&##",
  "#######@%..........................%#q##",
  "##.V.H.#%.......q.................%.H###",
  "##....#.#%..............&...........%###",
  "##.......%......A.............m....%####",
  "#...................6.&............E####",
  "#...................................#.##",
  "#K.....................................#",
  "########################################",
  "########################################",
  "########################################"
 ],
 "zones": {
  "vestiaire": [
   1,
   1,
   4,
   5
  ],
  "couloir_est": [
   5,
   2,
   3,
   3
  ],
  "salle_eau": [
   8,
   7,
   10,
   4
  ],
  "secret_glace": [
   19,
   7,
   6,
   4
  ],
  "couloir_nord": [
   5,
   1,
   3,
   1
  ],
  "reacteur": [
   10,
   1,
   20,
   5
  ],
  "couloir_sud": [
   5,
   6,
   3,
   1
  ],
  "salle_glace": [
   8,
   11,
   10,
   5
  ],
  "couloir_sud_est": [
   19,
   11,
   4,
   5
  ],
  "sanctuaire": [
   24,
   7,
   15,
   9
  ],
  "sortie_zone": [
   35,
   7,
   4,
   4
  ]
 },
 "style": "scifi"
}
