{
 "niveau": 55,
 "nom": "E55 — LE LABYRINTHE SANGUIN",
 "style": "scifi",
 "sky": false,
 "rows": [
  "#########################################",
  "#########################################",
  "#H.....##################################",
  "#......#############A......5#############",
  "#......%%%%%%%%%%%%#1.......!25##########",
  "#...P.....4......4.=..#..#..#############",
  "#......%%%%%%%%%%%%#....5...#############",
  "#......#############........#############",
  "#......#############.......1#############",
  "####################..q....H#############",
  "#######################%=%###############",
  "#######################%.%###############",
  "#######################%.%###############",
  "#######################%.%###############",
  "#######################%.%###############",
  "#######################%.%###############",
  "#######################%.%###############",
  "#######################%.%####2##########",
  "########################.#####1##########",
  "########################=#####!##########",
  "##################H......2.....1#########",
  "##################..............##%%%%%%#",
  "##################2.#..#..#..#..##%....%#",
  "##################.....................%#",
  "##################..............##%....%#",
  "##################..............##%....E#",
  "##################.....z.......2##%%%%%%#",
  "#########################################",
  "#########################################"
 ],
 "zones": {
  "vestibule": [
   1,
   2,
   6,
   7
  ],
  "conduit_nord": [
   8,
   5,
   10,
   1
  ],
  "chambre_aspiration": [
   20,
   3,
   8,
   7
  ],
  "veine_est": [
   24,
   11,
   1,
   6
  ],
  "noyau_pulsant": [
   18,
   20,
   14,
   7
  ],
  "sortie_coeur": [
   35,
   22,
   4,
   4
  ]
 }
}
