{
 "niveau": 18,
 "nom": "E18 — LE PANTHÉON DE BASALTE",
 "style": "scifi",
 "sky": true,
 "angle": 0,
 "rows": [
  "#######################################",
  "#4........4.###...##.....5..######.L3##",
  "#.#####.##.#####..%%%.#.%.%..#####..E##",
  "#.........######.%%%#.%%%A.##.##.##.###",
  "#.#.#...##.#.###.%%%#.%%%V.....#....###",
  "#.#......#.....#..&#H..####.#####.##.##",
  "###.#####..#######..C#.=......w..V....#",
  "#..4.......#3......#.%%%%%%%%%.#..#..##",
  "#.######.##..######.#.m......%..#.###.#",
  "#k.....#.................H5%%%..#....5#",
  "#.#....#.####################%%##.#####",
  "#.#..#.#2..........#.........#...#....#",
  "#.#####.#.###########.2......=.#.4....#",
  "#x......#.....@.......###########.....#",
  "#.#...##.###.....~#.##........###.....#",
  "#........#...####~#.#...###.%..#..#####",
  "#################~#~#....#..#.#....####",
  "#.............~~~~##~...#..###..3#..###",
  "#.########=######~#H...#..#.##..S#.k###",
  "#.#m...........4#~~......#P..=..#..####",
  "#.#.....#######.#.....#..#######.#..###",
  "#.#5......K.........#!##..H.......#1.##",
  "#####################4#################",
  "#####################5#################",
  "#######################################",
  "#######################################",
  "#######################################",
  "#######################################"
 ]
}
