{
 "niveau": 82,
 "nom": "E82 — LE CHANTIER HÉLIOS",
 "style": "scifi",
 "sky": false,
 "rows": [
  "#########################################",
  "########%%%%%%%%%%%%############4########",
  "########%A...4....m%############&########",
  "#H.....#%..........%############!########",
  "#......#%..%..%....%###A.........oH#%%%%%",
  "#......#%..........%###4...........#%k.A%",
  "#...P...=.............=..#..#..#...#%@.&%",
  "#......#%..%..%....%###............#%...%",
  "#......#%..........%###......@......=&..%",
  "#......#%..@......4%###..#..#..#...#%..@%",
  "########%%%%%%%%%%%%###............#%&..%",
  "#######################............#%%.%%",
  "#######################.@.........4###.##",
  "#############################!########.##",
  "#############################@########.##",
  "#############################&########.##",
  "######################################.##",
  "######################################.##",
  "############H@...#####################.##",
  "############.....#####################.##",
  "############&...&=..................H..##",
  "############.....########################",
  "################E########################",
  "#########################################",
  "#########################################",
  "#########################################",
  "#########################################",
  "#########################################",
  "#########################################"
 ],
 "zones": {
  "vestiaire": [
   1,
   3,
   6,
   7
  ],
  "passerelle": [
   9,
   2,
   10,
   8
  ],
  "hangar": [
   23,
   4,
   12,
   9
  ],
  "docks": [
   37,
   5,
   3,
   6
  ],
  "sortie_zone": [
   12,
   18,
   5,
   4
  ]
 }
}
