{
 "niveau": 10,
 "nom": "E10 — LE CŒUR FRACTURÉ",
 "style": "scifi",
 "sky": true,
 "angle": 0,
 "rows": [
  "#################################",
  "#P....#....&..1........m......###",
  "#.....%...............A.......###",
  "%####=%.%%.%............@O.....##",
  "%.......#.4...Q......r........E##",
  "#.......#....3...........V...H.##",
  "#.52....#.K...........Q..S...L.##",
  "####$###.%%.%.............I&..m##",
  "#......%.%..%...................#",
  "#.m....%R%%%%%%%##############%##",
  "%......A.................&......#",
  "%.w........................@...##",
  "#.....O.L......O...g.......Q....#",
  "########.%%.%.............H..V.##",
  "#......I.%..%...................#",
  "#.......%.%%%%%%%##############%#",
  "%......m.................&......#",
  "%.1........................@...##",
  "#.......L......O..O2....O.......#",
  "########.%%.%.............H..V.##",
  "#......I.%..%...................#",
  "#....3..%#%%%%%%%##############%#",
  "#################################"
 ]
}
