{
 "niveau": 4,
 "nom": "E4 — NÉCROPOLE CÉLESTE",
 "style": "scifi",
 "sky": true,
 "angle": 0,
 "rows": [
  "##################################",
  "#1.=...........................###",
  "#..#....................%...1..###",
  "E..#.%%###.%%%...%%%%%.%%%.....###",
  "#..#.%........%.........%.k....###",
  "#..#.%........%.........%....A.###",
  "#..#%%..........%%%%%%%%.......###",
  "#..#.C......Q....Q........O....###",
  "####...........4.................#",
  "#...............................5#",
  "#....###.%%######.#%%%%%%%%%%%%%##",
  "#...5#.....~~~.................###",
  "#....#....H~~~.......%.....L...###",
  "#...%.%%%##########.%..........###",
  "#................%......mO...Q..##",
  "#........%.......%...O..........##",
  "####################.....4......##",
  "#....H............=............###",
  "#..###.%%######=#%%%%%%%%%%%%%%%##",
  "#..#............................##",
  "#..#.%%###.%%%...%%%%%.%%%.....###",
  "#..#.%..2.O...%......Q..%......###",
  "#..#.%..Q.....%.........%......###",
  "####.......Q..Q...........Q.....##",
  "#..................5.............#",
  "#4.##..........#####.....S......P#",
  "##################################"
 ]
}
