{
 "niveau": 87,
 "nom": "E87 — LE SILLON DE BRUME",
 "style": "scifi",
 "sky": false,
 "rows": [
  "########################################",
  "############H.....###########%%%%%%%%%%#",
  "############......###########%A.....5.%#",
  "####...........P.............=4.......%#",
  "####.#######......###########%..%..%..%#",
  "####.#######......#######..K..........%#",
  "####.####################.###%........%#",
  "####.####################.###%.......4%#",
  "####$####################.###%%%%##$##%#",
  "##..H.########H.........&.########V..###",
  "##....########............!42#####...###",
  "##....########............##############",
  "##############............##############",
  "##############............##############",
  "##############3...........##############",
  "###########45!............##############",
  "##############............##############",
  "##############............###%%%%%%%%%%#",
  "##############k..........3...=......qA%#",
  "#############################%4.......%#",
  "###############%%%%%%%%%%####%..%..%..%#",
  "###############%H...2..A%####%...5....%#",
  "###############%........%E###%.......j%#",
  "###############%........J.....5.....dm%#",
  "###############%2..2....%####%%%%%%%%%%#",
  "###############%.......6%###############",
  "###############%%%%%%%%#%###############",
  "########################################"
 ],
 "zones": {
  "vestibule": [
   12,
   1,
   6,
   5
  ],
  "galerie_nord": [
   30,
   2,
   8,
   6
  ],
  "puits": [
   14,
   9,
   12,
   10
  ],
  "galerie_sud": [
   30,
   18,
   8,
   6
  ],
  "chambre_cles": [
   2,
   9,
   4,
   3
  ],
  "sortie_finale": [
   16,
   21,
   8,
   5
  ],
  "reduit_cache": [
   34,
   9,
   3,
   2
  ]
 }
}
