{
 "niveau": 69,
 "nom": "E69 — LA CATHÉDRAL DE FER",
 "style": "scifi",
 "sky": false,
 "rows": [
  "#######%%%%%%%%%%%#######################",
  "#H....#%A.4.....A%#######################",
  "#.....#%.....s...%############....#######",
  "#..P...=........4.....K.I....$H...#######",
  "#......%.........%############....#######",
  "######.%o...4....%###########5###########",
  "%%%%%%.%%%%%%%%%%%###########4###########",
  "%C.....###############%%%%%%%!%%%########",
  "%4.....###############%H......5k%########",
  "%...............&..H##%5........%########",
  "%A5..4%#............##%.........%########",
  "%%%%%%%#..#..#..#...##%....&....%########",
  "########............##%.........%########",
  "########............##%.........%########",
  "########3.#..#..#.....=.&......5%########",
  "########......&.....##%.%%%%%%%%%########",
  "########............###.%%%%%############",
  "########............###.%V.M%############",
  "########m..........3###.$...%############",
  "###############!#######.%...%############",
  "###############5#######.%%%%%############",
  "###############&#######.#################",
  "#######################.#################",
  "##########H..2..4A#####.#################",
  "##########2.......#E###.#################",
  "##########........Jj....#################",
  "##########...4..w.#######################",
  "#########################################",
  "#########################################"
 ],
 "zones": {
  "vestiaire": [
   1,
   1,
   5,
   4
  ],
  "galerie_nord": [
   8,
   1,
   9,
   5
  ],
  "chambre_clef": [
   30,
   2,
   4,
   3
  ],
  "depot_armes": [
   1,
   7,
   5,
   4
  ],
  "refinerie": [
   8,
   9,
   12,
   10
  ],
  "bassin_lave": [
   23,
   8,
   9,
   7
  ],
  "hangar_sortie": [
   10,
   23,
   8,
   4
  ],
  "cache_sous_sol": [
   25,
   17,
   3,
   3
  ]
 }
}
