{
 "niveau": 32,
 "nom": "E32 — CATHÉDRALE GELÉE",
 "rows": [
  "########################################",
  "#P.....#...................#H..........#",
  "#......=..4.....%...A......#.k.......E.#",
  "#......#..5.....%..........#..3.......##",
  "#..H...#........%..........#...3......E#",
  "####$###..m.....%..........#...........#",
  "##.rx.##........%..........#.A.........#",
  "########..%%%%%%%%%%%%%%%%%#...........#",
  "#.............5.......2................#",
  "#......................................#",
  "#...&..............g...............3...#",
  "#..........................#...........#",
  "#.....H.......5............m...........#",
  "#......................................#",
  "#........4..........A.........1........#",
  "####=###################..##############",
  "#...........................6......M.E##",
  "#.4...&..............H.............E..##",
  "#.............................&.......##",
  "#............5.......................E.#",
  "#......................................#",
  "#........3..........A.........2........#",
  "####=###################..##############",
  "#...........................6......M.E##",
  "#.4...&..............H.............E..##",
  "#.............................&.......##",
  "#............5.......................E##",
  "########################################"
 ],
 "zones": {
  "vestibule": [
   1,
   1,
   6,
   5
  ],
  "nef_ouest": [
   8,
   2,
   9,
   4
  ],
  "chapelle_rouge": [
   2,
   7,
   3,
   1
  ],
  "navee_principale": [
   1,
   9,
   38,
   6
  ],
  "crypte_givrante": [
   25,
   12,
   2,
   1
  ],
  "trav_ee_nord": [
   30,
   2,
   7,
   4
  ],
  "absidiole": [
   1,
   17,
   38,
   6
  ]
 },
 "style": "scifi"
}
