{
 "niveau": 93,
 "nom": "E93 — LA GALERIE DES MÂCHOIRES",
 "style": "scifi",
 "sky": false,
 "rows": [
  "#########################################",
  "#########################################",
  "#H.....##################################",
  "#......%%%%%%%%%%%%######################",
  "#...P..=..........%################H2..k#",
  "#......%...4.....4%################.....#",
  "#......%#####..%%%%#########3######....6#",
  "#########bA.1..#############4######.....#",
  "#########n.....##########%%%!%%%%%#.....#",
  "#########.5....##########%H..5..3m#.2...#",
  "#########H.5.q.##########%3.......#.....#",
  "##############.##########%..%..%..#.....#",
  "#########%%%%%B%%%%%#####%....5...=.....#",
  "#########%H.....4.....I.K=........#....zE",
  "#########%4........######%........####!##",
  "#########%..%..%...#V..A#%.3.....3%###5##",
  "#########%....5....$....#%%%%%%%%%%###4##",
  "#########%.........#....#################",
  "#########%.........######################",
  "#########%A.5.....4%#####################",
  "#########%%%%%%%%%%%#####################",
  "#########################################",
  "#########################################",
  "#########################################",
  "#########################################",
  "#########################################",
  "#########################################",
  "#########################################",
  "#########################################"
 ],
 "zones": {
  "vestibule": [
   1,
   2,
   6,
   5
  ],
  "conduite_ouest": [
   8,
   4,
   10,
   2
  ],
  "chambre_verrouillee": [
   9,
   7,
   5,
   4
  ],
  "galerie_centrale": [
   10,
   13,
   9,
   7
  ],
  "arret_de_securite": [
   20,
   15,
   4,
   3
  ],
  "gouffre_noye": [
   26,
   9,
   8,
   7
  ],
  "arene_finale": [
   35,
   4,
   5,
   10
  ]
 }
}
