{
 "niveau": 86,
 "nom": "E86 — LE PHARE NOYÉ",
 "style": "scifi",
 "sky": false,
 "rows": [
  "######################################",
  "##############H......#################",
  "#%%%%%%%%%%%##.......#################",
  "#%A....5...=.....P......=.....5...A###",
  "#%.........%##.......####..........###",
  "#%..%..%...%##.......####..........###",
  "#%.........%#############..........###",
  "#%d........%#############..........###",
  "#%H.......z%##########34!..........###",
  "#%%%%%%.%%%%#############4........4###",
  "#######.#########################.####",
  "###%%%%=%%%######################.####",
  "###%H...4A%######################.####",
  "###%......%######################=####",
  "###%.........................=3.....H#",
  "###%......%###################......5#",
  "###%3....4%###################..#....#",
  "###%%!%%%%%###################.......#",
  "#####5#####################..........#",
  "#####4###################%%=%%..#....#",
  "#########################%A.H%5......#",
  "#########################%...%A.....3#",
  "#########################%...%########",
  "#########################%..6%########",
  "#########################%%%E%########",
  "######################################"
 ],
 "zones": {
  "vestibule": [
   14,
   1,
   7,
   5
  ],
  "pont_ouest": [
   2,
   3,
   9,
   6
  ],
  "pont_est": [
   25,
   3,
   10,
   7
  ],
  "cages": [
   4,
   12,
   6,
   5
  ],
  "lanterne": [
   30,
   14,
   7,
   8
  ],
  "chambre": [
   26,
   20,
   3,
   4
  ]
 }
}
