{
 "niveau": 22,
 "nom": "E22 — CATHÉDRALE DES OS",
 "rows": [
  "########################################",
  "#....#..........#......#..............E#",
  "#.P..#.x...5....#......................#",
  "#....=..........#......................#",
  "#....#..........#........w.......2.....#",
  "#....#..........#......................#",
  "#....#..........%..3............3......#",
  "######...........%.........A...........#",
  "#...V.#.....H...%.5....................#",
  "#................#.....................#",
  "#####..........#.s......5......1.......#",
  "#..............#.......................#",
  "#..............4...............#.......#",
  "#......................................#",
  "####...........%.............H.........#",
  "#...#j...A.....%.6..................&..#",
  "#..............#.5..............2......#",
  "#......................................#",
  "#####..........#.......................#",
  "#H.............s...............#.......#",
  "#......................................#",
  "####...........%.............H.........#",
  "#........A.....%.6..................&..#",
  "#..............#.5..............2......#",
  "#......................................#",
  "#####..........#.......................#",
  "#..............s...............#.......#",
  "########################################"
 ],
 "zones": {
  "vestibule": [
   1,
   1,
   6,
   9
  ],
  "nef_ouest": [
   7,
   2,
   8,
   5
  ],
  "crypte_bleue": [
   0,
   3,
   4,
   3
  ],
  "nef_principale": [
   0,
   10,
   40,
   17
  ],
  "planque_osseuse": [
   0,
   9,
   6,
   2
  ],
  "chapellette": [
   25,
   8,
   14,
   10
  ],
  "crypte_jaune": [
   36,
   9,
   4,
   3
  ],
  "arene_reliquaire": [
   17,
   10,
   18,
   17
  ],
  "sortie": [
   37,
   25,
   3,
   3
  ]
 },
 "style": "scifi"
}
