{
 "niveau": 56,
 "nom": "E56 — LE NID DE VERRE",
 "style": "scifi",
 "sky": false,
 "rows": [
  "#####################%%%%################",
  "#################.......%################",
  "#A5...q#######H......%%.%#####A4...1#####",
  "#......#%%####.......##.######...4..#####",
  "#..#...#4%####.......##......=......#####",
  "#1...5.=4........P...##.######......#####",
  "#......#%%####.......##H######1...4.#####",
  "#......#######.......##.#################",
  "#.....q##########%%.%##.#################",
  "####.############%..%##.#################",
  "####.############%%.%##.#################",
  "####.##############.###.#################",
  "####.##############=###=#################",
  "####..=A3.................H##############",
  "#######...................5##############",
  "####45!..#..#..#..#..#..#..##############",
  "#######....................##############",
  "#######....................##############",
  "#######..#..#..#.5#..#..#..##############",
  "#######....................##############",
  "#######....................##############",
  "#######..#.5#..#..#..#..#..##############",
  "####1##....................##############",
  "####4##...................3##############",
  "%%%%!%%..#..#..#..#..#..#..##############",
  "%.....%....................##############",
  "%......6..........5.......H##############",
  "%E%%%%%##################################",
  "#########################################"
 ],
 "zones": {
  "vestibule": [
   14,
   2,
   7,
   6
  ],
  "corridor_ouest": [
   8,
   4,
   1,
   2
  ],
  "salle_verre": [
   1,
   2,
   6,
   7
  ],
  "corridor_nord": [
   22,
   1,
   2,
   1
  ],
  "salle_est": [
   30,
   2,
   6,
   5
  ],
  "corridor_sud": [
   18,
   9,
   2,
   1
  ],
  "noyau_central": [
   7,
   13,
   20,
   14
  ],
  "sortie_noyau": [
   1,
   25,
   5,
   2
  ]
 }
}
