{
 "niveau": 96,
 "nom": "E96 — LA TRANCHEE DU SEL",
 "style": "scifi",
 "sky": false,
 "rows": [
  "#########################################",
  "#########################################",
  "#H....#%%%%%%%%%%%%%%###H...5A###########",
  "#.......A..4.......4...=3.....###########",
  "#..P..#%%%%%%%.%%%%%%###......###########",
  "#.....########.#########......###########",
  "##############.#########.....3###########",
  "#########%%%%%=%%%%%########.############",
  "#########%r......4H%########K############",
  "#########%.........%########=############",
  "#########%4.%.5%........4..4...x#########",
  "#########%.........%##########.##########",
  "#########%.........%##########.##########",
  "#########%.........%##########.##########",
  "#########%m..5....4%#####%%%%%R%%%%%#####",
  "#########%%%%%!%%%%%#####%H......ok%#####",
  "##############4##########%2........%#####",
  "##############5##########%..%..%...%##3##",
  "#########################%.........%##5##",
  "#########################%.........%##!##",
  "#########################%..%..%...%#...#",
  "#########################%.........%#...#",
  "#########################%..5.....6.....#",
  "#########################%%%%%%%%%%%#...E",
  "#########################################",
  "#########################################",
  "#########################################",
  "#########################################",
  "#########################################"
 ],
 "zones": {
  "vestiaire": [
   1,
   2,
   5,
   4
  ],
  "tranchee_ouest": [
   8,
   3,
   12,
   1
  ],
  "poste_observation": [
   24,
   2,
   6,
   5
  ],
  "citerne_sel": [
   10,
   8,
   9,
   7
  ],
  "galerie_basse": [
   24,
   10,
   8,
   1
  ],
  "poste_commandement": [
   26,
   15,
   9,
   8
  ],
  "sortie_nord": [
   37,
   20,
   3,
   4
  ]
 }
}
